<?xml version="1.0"?>
<!--
/**
 * Sales + Cart trigger metadata (relocated from mage-os/workflows-triggers-core,
 * domain-packs S1). The sales "created/updated" events are declared by
 * mage-os/mageos-common-async-events; sales.order.status_changed and
 * quote.abandoned are declared by this module (etc/async_events.xml).
 */
-->
<triggers xmlns:xsi="http://www.w3.org/2001/XMLSchema-instance"
          xsi:noNamespaceSchemaLocation="urn:magento:module:MageOS_Workflows:etc/workflow_triggers.xsd">
    <!-- Sales -->
    <trigger event="sales.order.created" entity="sales_order" label="Order Created" group="Sales"/>
    <trigger event="sales.order.updated" entity="sales_order" label="Order Updated" group="Sales"/>
    <trigger event="sales.order.status_changed" entity="sales_order" label="Order Status Changed" group="Sales"/>
    <trigger event="sales.invoice.created" entity="sales_order" label="Invoice Created" group="Sales"/>
    <trigger event="sales.shipment.created" entity="sales_order" label="Shipment Created" group="Sales"/>
    <trigger event="sales.creditmemo.created" entity="sales_order" label="Credit Memo Created" group="Sales"/>

    <!-- Cart -->
    <trigger event="quote.abandoned" entity="quote" label="Cart Abandoned" group="Cart"/>
</triggers>
